question,ground_truth,answer,answer_source,contexts,judge_result,top_chunk_score,top_chunk_src,answer_correctness,faithfulness,response_relevancy,context_precision,context_recall
dove si trova la sede principale dell'ateneo,"La sede principale dell'Università degli Studi di Trieste si trova a Trieste, in Piazzale Europa 1, in un'area sopraelevata rispetto al centro della città.","La sede principale dell'Ateneo si trova a Trieste, in Piazzale Europa 1.",https://portale.units.it/it/ateneo/campus,"1): (tokens: 493) (url: https://portale.units.it/it/ateneo/campus) (score: 0.4341) * Futuri studenti
  * Studenti iscr...
2): (tokens: 152) (url: https://www.units.it/strutture/index.php/area/ateneo/strutture/000133?pf=stampa) (score: 0.3954) |   
Vendramini Riccardo |  Rappr. ...
3): (tokens: 169) (url: https://www.units.it/strutture/index.php/area/ateneo/menu/organigramma/strutture/028696?pf=stampa) (score: 0.3939) * * *

# Unita' Clinica Operativa d...
4): (tokens: 180) (url: https://www.units.it/strutture/index.php/area/ateneo/menu/organigramma/strutture/080030?pf=stampa) (score: 0.3870) * * *

# Unita' Clinica Operativa d...
5): (tokens: 209) (url: https://www.units.it/strutture/index.php/from/organigramma/area/ateneo/menu/organigramma/strutture/095100?pf=stampa) (score: 0.3858) * * *

# Centro Interdipartimentale...
6): (tokens: 155) (url: https://www.units.it/persone/index.php/from/organigramma/area/ateneo/menu/organigramma/persona/41401?pf=stampa) (score: 0.3844) * * *

#  Elisa Brentan 

**Compone...",pass,0.4341,https://portale.units.it/it/ateneo/campus,0.7144,1.0,0.8265,1.0,1.0
"edificio, piano e aula stampare all università","È possibile stampare presso l'edificio H3, situato nel polo di Piazzale Europa, al quinto piano all'interno delle aule informatiche.","Le stampanti sono disponibili nell'Edificio H3, al 5° piano, all'interno delle aule informatiche.",https://portale.units.it/it/ateneo/campus/trieste/piazzale-europa-polo/aula-informatica,"1): (tokens: 483) (url: https://portale.units.it/it/ateneo/campus/trieste/piazzale-europa-polo/aula-informatica) (score: 0.4563) * Futuri studenti
  * Studenti iscr...
2): (tokens: 407) (url: https://amm.units.it/normativa/regolamenti/articolo-52947/art-12-modalita-gestione-attrezzature-e-dispositivi-aula) (score: 0.4173) * Futuri studenti
  * Studenti iscr...
3): (tokens: 339) (url: https://amm.units.it/normativa/regolamenti/articolo-52939/art-4-tipologia-spazi) (score: 0.4172) Regolamento per la gestione degli s...
4): (tokens: 345) (url: https://df.units.it/it/content/aula-room) (score: 0.4137) Astroparticelle e Onde Gravitaziona...
5): (tokens: 157) (url: https://amm.units.it/normativa/regolamenti/articolo-52965/art-27-dotazione-arredi-e-attrezzature-negli-studiuffici) (score: 0.4136) * Futuri studenti
  * Studenti iscr...
6): (tokens: 157) (url: https://amm.units.it/normativa/regolamenti/articolo-52967/art-29-referenti-edificio-e-struttura) (score: 0.4132) * Futuri studenti
  * Studenti iscr...",pass,0.4563,https://portale.units.it/it/ateneo/campus/trieste/piazzale-europa-polo/aula-informatica,0.8604,1.0,0.5935,1.0,1.0
requisiti: titolo di studio richiesto per immatricolazione a ingegneria elettronica e informatica,Il titolo richiesto è il diploma di scuola media superiore o titolo estero equipollente. Per i titoli esteri è necessario verificare la validità presso la sezione Studenti Internazionali.,"Per immatricolarsi al corso di Ingegneria Elettronica e Informatica è necessario essere in possesso di un diploma di scuola media superiore o di un titolo di studio equipollente conseguito all'estero. Per i titoli esteri, è consigliabile consultare le informazioni dedicate agli Studenti Internazionali per verificarne la validità e i requisiti specifici di accesso.",https://lauree.units.it/it/0320106200800001/come-iscriversi,"1): (tokens: 446) (url: https://lauree.units.it/it/0320106200800001/come-iscriversi) (score: 0.5710) ENG

Area studenti

  * Home
  * Il...
2): (tokens: 421) (url: https://lauree.units.it/it/0320106200800001) (score: 0.5300) * richiedenti visto



Vedi info am...
3): (tokens: 402) (url: https://lauree.units.it/it/0320106200800001/il-corso) (score: 0.5296) Laurea 

# INGEGNERIA ELETTRONICA E...
4): (tokens: 399) (url: https://lauree.units.it/it/0320106200800001/come-iscriversi) (score: 0.5195) Non hai ancora conseguito il titolo...
5): (tokens: 175) (url: https://lauree.units.it/it/0320106200800001) (score: 0.5129) ENG

Area studenti

  * Home
  * Il...
6): (tokens: 379) (url: https://lauree.units.it/it/0320106200800001/come-iscriversi) (score: 0.5007) Non hai ancora conseguito il titolo...",pass,0.571,https://lauree.units.it/it/0320106200800001/come-iscriversi,0.8548,1.0,0.8511,0.75,1.0
i curricula del corso Scienze e Tecnologie per l'ambiente e la natura,"I curriculum sono tre: Ambientale, Biologico e Didattico.","Il corso di Scienze e Tecnologie per l'ambiente e la natura è strutturato in tre curricula, che devono essere scelti a partire dal secondo anno:

*   Curriculum biologico
*   Curriculum ambientale
*   Curriculum didattico",https://www.biologia.units.it/index.php?/corsi/5/Laurea-in-Scienze-e-Tecnologie-per-lambiente-e-la-natura,"1): (tokens: 477) (url: https://lauree.units.it/it/0320106203200001/piano-di-studi) (score: 0.5720) Area studenti

  * Home
  * Il cors...
2): (tokens: 351) (url: https://lauree.units.it/it/0320106203200001/area-studenti/insegnamenti/2027/116559-1/2025/3/10794/2025/13316) (score: 0.5576) Area studenti

  * Home
  * Il cors...
3): (tokens: 352) (url: https://lauree.units.it/it/0320106203200001/area-studenti/insegnamenti/2027/116559-2/2025/3/10794/2025/13316) (score: 0.5536) Area studenti

  * Home
  * Il cors...
4): (tokens: 95) (url: https://lauree.units.it/it/0320106203200001/il-corso) (score: 0.5481) Area studenti

  * Home
  * Il cors...
5): (tokens: 434) (url: https://lauree.units.it/it/0320106203200001/il-corso) (score: 0.5454) Laurea 

# SCIENZE E TECNOLOGIE PER...
6): (tokens: 210) (url: https://lauree.units.it/it/0320106203200001/area-studenti/scelta-piano-di-studi/descrizione-piano-di-studi) (score: 0.5419) **Presenta il tuo piano degli studi...",pass,0.572,https://lauree.units.it/it/0320106203200001/piano-di-studi,0.8535,1.0,0.8911,0.2667,1.0
i 3 docenti tutor dei 3 curricula del corso Scienze e Tecnologie per l'ambiente e la natura,Curriculum Biologico: Prof. Stanislao Bevilacqua. Curriculum Ambientale: Prof. Pieluigi Barbieri.,"I tre docenti tutor per i curricula del corso di Scienze e Tecnologie per l'Ambiente e la Natura sono:

*   **Curriculum Biologico**: Prof. Stanislao Bevilacqua (email: sbevilacqua@units.it)
*   **Curriculum Ambientale**: Prof. Pierluigi Barbieri (email: barbierp@units.it)
*   **Curriculum Didattico**: Prof. Michele Stoppa (email: mstoppa@units.it)

Gli studenti interessati a un colloquio di orientamento possono contattare il docente tutor via mail per concordare tempi e modalità dell'incontro.",https://www.biologia.units.it/index.php?/corsi/5/Laurea-in-Scienze-e-Tecnologie-per-lambiente-e-la-natura,"1): (tokens: 375) (url: https://www.biologia.units.it/index.php?/corsi/5/Laurea-in-Scienze-e-Tecnologie-per-lambiente-e-la-natura) (score: 0.5816) \---

**Docenti Tutor Curriculari**...
2): (tokens: 379) (url: https://lauree.units.it/it/0320106203200001/area-studenti/tutorato) (score: 0.5567) Area studenti

  * Home
  * Il cors...
3): (tokens: 475) (url: https://lauree.units.it/it/0320106203200001/area-studenti/tutorato) (score: 0.5558) #### Perché sono efficaci?

Essendo...
4): (tokens: 453) (url: https://www.biologia.units.it/index.php?/corsi/5/Laurea-in-Scienze-e-Tecnologie-per-lambiente-e-la-natura) (score: 0.5268) # 

# Laurea in Scienze e Tecnologi...
5): (tokens: 351) (url: https://lauree.units.it/it/0320106203200001/area-studenti/insegnamenti/2027/116559-1/2025/3/10794/2025/13316) (score: 0.5268) Area studenti

  * Home
  * Il cors...
6): (tokens: 352) (url: https://lauree.units.it/it/0320106203200001/area-studenti/insegnamenti/2027/116559-2/2025/3/10794/2025/13316) (score: 0.5236) Area studenti

  * Home
  * Il cors...",pass,0.5816,https://www.biologia.units.it/index.php?/corsi/5/Laurea-in-Scienze-e-Tecnologie-per-lambiente-e-la-natura,0.4544,1.0,0.8572,0.8333,1.0
contatti orari e indirizzo Ufficio Applicativi per la carriera dello studente e i contributi universitari,"Ufficio Applicativi per la carriera dello studente e i contributi universitari: Piazzale Europa 1, Edificio A. Tel: +39 040 558 3731 (mar, mer, ven 12-13). Email: tasse.studenti@amm.units.it. Sportello su prenotazione (EasyPlanning): Lunedì 15:00-16:40 e Giovedì 09:00-11:10.","L'Ufficio Applicativi per la carriera dello studente e i contributi universitari si trova in Piazzale Europa, 1 - 34127 - TRIESTE, presso l'Edificio Centrale A.

Per quanto riguarda i contatti e gli orari:

*   **Servizio telefonico:**
    *   Martedì, Mercoledì, Venerdì: dalle 12:00 alle 13:00
    *   Telefono: +39 040 558 3731
*   **E-mail:** tasse.studenti@amm.units.it
*   **Ricevimento su prenotazione:**
    *   L'ufficio riceve su prenotazione nei seguenti orari:
        *   Lunedì: dalle 15:00 alle 16:40
        *   Giovedì: dalle 9:00 alle 11:10
    *   Per prenotare, è necessario accedere al servizio EasyPlanning e scegliere il servizio ""Tasse"". È possibile fissare un appuntamento fino al giorno antecedente a quello prescelto. Per accedere agli sportelli è richiesta la ricevuta di prenotazione e un documento di identità. È possibile delegare una terza persona, munita di delega e copia del documento di identità del delegante.",https://portale.units.it/it/studiare/contributi/lauree-magistrali-e-magistrali-ciclo-unico,"1): (tokens: 214) (url: https://www.units.it/strutture/index.php/from/organigramma/area/ateneo/menu/organigramma/strutture/028718?pf=stampa) (score: 0.5855) * * *

# Ufficio Applicativi per la...
2): (tokens: 495) (url: https://portale.units.it:443/it/studiare/contatti/carriera-studenti) (score: 0.5332) * Futuri studenti
  * Studenti iscr...
3): (tokens: 437) (url: https://portale.units.it:443/it/studiare/contatti/carriera-studenti) (score: 0.5311) ## 

Utilizza l'**email universitar...
4): (tokens: 445) (url: https://amm.units.it/placement/chi-siamo/contatti-e-orari) (score: 0.5149) * Futuri studenti
  * Studenti iscr...
5): (tokens: 462) (url: https://portale.units.it:443/it/studiare/contributi/lauree-magistrali-e-magistrali-ciclo-unico) (score: 0.5105) Per tutte le informazioni, consulta...
6): (tokens: 137) (url: https://portale.units.it:443/it/studiare/contatti/carriera-studenti) (score: 0.5061) studenti@amm.units.it******  
**Tel...",pass,0.5855,https://www.units.it/strutture/index.php/from/organigramma/area/ateneo/menu/organigramma/strutture/028718?pf=stampa,0.7738,1.0,0.8267,0.2,1.0
iniziativa Climbing for Climate (CFC),"Iniziativa promossa da RUS e CAI per sensibilizzare sul riscaldamento globale. Il nome richiama i clorofluorocarburi (CFC), gas responsabili del buco nell'ozono banditi dal Protocollo di Montreal. L'ateneo partecipa organizzando eventi sul territorio.",Le informazioni sull'iniziativa Climbing for Climate (CFC) non sono disponibili nel contesto fornito.,https://portale.units.it/it/terza-missione/sostenibilita,"1): (tokens: 198) (url: https://dia.units.it/en/department/people/teaching-staff?q=en/node/2175) (score: 0.3714) | Active  
Sustainable Urban areas ...
2): (tokens: 367) (url: https://lauree.units.it/it/0320107300700004/assicurazione-qualita/rilevazione-opinione-studenti) (score: 0.3681) Area studenti

  * Home
  * Il cors...
3): (tokens: 457) (url: https://lauree.units.it/it/0320107300700004/area-studenti/insegnamenti/2025/119364/2025/9999/10824/2025/13311) (score: 0.3630) ## 

Students are expected to have ...
4): (tokens: 374) (url: https://lauree.units.it/it/0320107300700004/area-studenti/appelli-esame) (score: 0.3612) Area studenti

  * Home
  * Il cors...
5): (tokens: 337) (url: https://lauree.units.it/it/0320107300700004/come-iscriversi) (score: 0.3595) In alternativa, puoi accedere al co...
6): (tokens: 478) (url: https://lauree.units.it/it/0320107300700004/piano-di-studi) (score: 0.3581) Consulta l'ultimo Piano di Studi di...",fail,0.3714,https://dia.units.it/en/department/people/teaching-staff?q=en/node/2175,0.1268,1.0,0.0,0.0,0.0
inizio e fine lezioni primo semestre SCIENZE INTERNAZIONALI E DIPLOMATICHE,Le lezioni iniziano il 22 settembre 2025 (il 1 ottobre per gli studenti del primo anno) e terminano il 19 dicembre 2025.,Il primo semestre per il corso di Scienze Internazionali e Diplomatiche inizia il 22 settembre 2025 e termina il 19 dicembre 2025. Si segnala che gli studenti del 1° anno iniziano il primo semestre il 1° ottobre 2025.,https://degree.units.it/it/0320106203600002/area-studenti/calendario-didattico,"1): (tokens: 378) (url: https://degree.units.it/it/0320106203600002/area-studenti/calendario-didattico) (score: 0.5831) > ***NOTA:**  
>  Gli **studenti de...
2): (tokens: 378) (url: https://lauree.units.it/it/0320106203600002/area-studenti/calendario-didattico) (score: 0.5831) > ***NOTA:**  
>  Gli **studenti de...
3): (tokens: 349) (url: https://lauree.units.it/it/0320106203600002/area-studenti/calendario-didattico) (score: 0.5376) Area studenti

  * Home
  * Il cors...
4): (tokens: 336) (url: https://degree.units.it/it/0320106203600002/area-studenti/calendario-didattico) (score: 0.5369) Area studenti

  * Home
  * Il cors...
5): (tokens: 343) (url: https://lauree.units.it/it/0320106203600002/area-studenti/insegnamenti/2026/113623/2025/9999/10770/2025/13109) (score: 0.5242) Area studenti

  * Home
  * Il cors...
6): (tokens: 237) (url: https://lauree.units.it/it/0320106203600002/area-studenti/insegnamenti/2025/116732/2024/9999/10227/2024/13107) (score: 0.5121) Area studenti

  * Home
  * Il cors...",pass,0.5831,https://degree.units.it/it/0320106203600002/area-studenti/calendario-didattico,0.9302,1.0,0.8135,0.4167,1.0
inizio e fine lezioni primo semestre SCIENZE E TECNICHE PSICOLOGICHE,"Il primo semestre inizia il 29 settembre 2025 per il I anno e il 22 settembre per gli anni successivi, con termine il 19 dicembre 2025 per tutti.","Per il corso di SCIENZE E TECNICHE PSICOLOGICHE, le lezioni del primo semestre si svolgono:

*   Per il I anno: dal 29 settembre 2025 al 19 dicembre 2025
*   Per il II e III anno: dal 22 settembre 2025 al 19 dicembre 2025",https://degree.units.it/it/0320106202400001/area-studenti/calendario-didattico,"1): (tokens: 306) (url: https://degree.units.it/it/0320106202400001/area-studenti/calendario-didattico) (score: 0.5209) Area studenti

  * Home
  * Il cors...
2): (tokens: 234) (url: https://lauree.units.it/it/0320106202400001/area-studenti/insegnamenti/2025/115285/2018/9999/10247) (score: 0.4992) Area studenti

  * Home
  * Il cors...
3): (tokens: 243) (url: https://lauree.units.it/it/0320106202400001/area-studenti/insegnamenti/2025/118501/2016/9999/10249) (score: 0.4870) Area studenti

  * Home
  * Il cors...
4): (tokens: 344) (url: https://lauree.units.it/it/0320106202400001/area-studenti/insegnamenti/2026/118520/2025/9999/10798/2025/13279) (score: 0.4805) Area studenti

  * Home
  * Il cors...
5): (tokens: 316) (url: https://lauree.units.it/it/0320106202400001/area-studenti/insegnamenti/2025/114122/2023/9999/10175/2023/) (score: 0.4745) Area studenti

  * Home
  * Il cors...
6): (tokens: 228) (url: https://degree.units.it/en/0320106204700003/students-area/taught-courses/2025/117415-3/2022/9999/10505/2023/) (score: 0.4707) ITA

Student area

  * Home
  * The...",pass,0.5209,https://degree.units.it/it/0320106202400001/area-studenti/calendario-didattico,0.9356,1.0,0.8179,1.0,1.0
dove si trova il materiale didattico corso Cybersecurity di Bartoli,"Il materiale didattico per il corso di Cybersecurity è disponibile sul sito del corso, dove si trova il programma dettagliato e molto altro materiale aggiuntivo. Le slide sono caricate su Microsoft Teams, e l'iscrizione al team è automatica.","Il materiale didattico per il corso di Cybersecurity si trova sul sito web del corso, dove è disponibile il programma dettagliato e molto materiale aggiuntivo. Le slide sono inoltre disponibili su Microsoft Teams; l'iscrizione al team sarà automatica, ma chi non dovesse essere iscritto automaticamente è invitato a contattare il docente via email.",https://degree.units.it/en/0320107303300001/students-area/taught-courses/2025/120014/2025/2/10740/2025,"1): (tokens: 378) (url: https://bartoli.inginf.units.it/didattica/cybersecurity) (score: 0.5031) Search this site

Embedded Files

A...
2): (tokens: 318) (url: https://bartoli.inginf.units.it/) (score: 0.4631) Search this site

Embedded Files

A...
3): (tokens: 423) (url: https://bartoli.inginf.units.it/didattica/reti-di-calcolatori) (score: 0.4489) Search this site

Embedded Files

A...
4): (tokens: 377) (url: https://bartoli.inginf.units.it/didattica/cybersecurity) (score: 0.4441) ### 

Grading

Exams will be graded...
5): (tokens: 474) (url: https://bartoli.inginf.units.it/didattica/fast-track) (score: 0.4415) Search this site

Embedded Files

A...
6): (tokens: 242) (url: https://bartoli.inginf.units.it/didattica/reti-2) (score: 0.4387) Search this site

Embedded Files

A...",pass,0.5031,https://bartoli.inginf.units.it/didattica/cybersecurity,0.927,0.8333,0.8082,1.0,1.0
Regolmaneto in cui sono definite le modalità di elezione delle rappresentanze studentesche nei corsi interdipartimentali?,Le modalità di elezione delle rappresentanze studentesche nei consigli di dipartimento sono definite dal regolamento degli studenti (comma 7).,"Le modalità di elezione delle rappresentanze studentesche nei consigli di dipartimento, in rapporto ai corsi interdipartimentali, sono definite dal regolamento degli studenti.",https://amm.units.it/normativa/regolamenti/articolo-22178/art-31-corsi-studio,"1): (tokens: 124) (url: https://amm.units.it/normativa/regolamenti/articolo-22178/art-31-corsi-studio) (score: 0.5754) In rapporto ai corsi interdipartime...
2): (tokens: 413) (url: https://amm.units.it/normativa/regolamenti/articolo-22182/art-35-consiglio-scuola-interdipartimentale) (score: 0.5027) * Futuri studenti
  * Studenti iscr...
3): (tokens: 472) (url: https://amm.units.it/normativa/regolamenti/articolo-22175/art-28-consiglio-dipartimento) (score: 0.4796) Il mandato dei rappresentanti degli...
4): (tokens: 479) (url: https://amm.units.it/normativa/regolamenti/articolo-22175/art-28-consiglio-dipartimento) (score: 0.4765) * Futuri studenti
  * Studenti iscr...
5): (tokens: 470) (url: https://amm.units.it/normativa/regolamenti/articolo-34634/art-14-consigli-corsi-studio) (score: 0.4713) * Futuri studenti
  * Studenti iscr...
6): (tokens: 441) (url: https://amm.units.it/normativa/regolamenti/articolo-22180/art-33-scuole-interdipartimentali) (score: 0.4689) * Futuri studenti
  * Studenti iscr...",pass,0.5754,https://amm.units.it/normativa/regolamenti/articolo-22178/art-31-corsi-studio,0.5993,1.0,0.8778,1.0,0.0
Quali attività cura l'Università per facilitare l'inserimento nel mondo del lavoro?,"L'Università cura le attività di orientamento e tutorato e attiva servizi intesi ad agevolare l'inserimento nel mondo del lavoro di studenti e laureati. Favorisce inoltre la costituzione di associazioni di ex-alunni, finalizzate al mantenimento di relazioni con l'Ateneo e al sostegno delle sue attività istituzionali.","L'Università, tramite il suo Career Service, svolge diverse attività per facilitare l'ingresso dei giovani nel mondo del lavoro. Queste includono:

*   **Orientamento al lavoro:** Vengono organizzati laboratori di orientamento e attività con gli Alumni, come interviste, incontri ""Focus sulle professioni"", l'evento ""Homecoming - Aperitivo con gli Alumni"" e il programma di mentoring ""Mentors4UniTS"" per studenti magistrali. Viene inoltre offerto supporto per la scrittura del CV e la preparazione ai colloqui tramite un consulente di carriera digitale.
*   **Opportunità di tirocinio e lavoro:** L'Università raccoglie e pubblica annunci di tirocinio (curriculare ed extracurriculare) e offerte di lavoro sulla bacheca AlmaLaurea. Si occupa anche dell'attivazione di tirocini extracurriculari post lauream e della stipula di convenzioni di Ateneo per tirocini curriculari.
*   **Incontri con le aziende:** Vengono organizzati ""Recruiting day"" con le aziende per posizioni di lavoro o tirocinio e il ""Career day job@uniTS"". Le aziende hanno anche la possibilità di accedere alla banca dati AlmaLaurea dei CV di laureati e PhD.
*   **Collaborazione con gli Alumni:** Gli Alumni partecipano a interviste e incontri ""Focus sulle professioni"" per guidare studenti e laureati nel mercato del lavoro, condividendo la propria esperienza professionale.",https://amm.units.it/normativa/regolamenti/articolo-22145/art-1-natura-e-fini,"1): (tokens: 318) (url: https://amm.units.it/placement) (score: 0.4772) * Futuri studenti
  * Studenti iscr...
2): (tokens: 439) (url: https://amm.units.it/placement/studenti) (score: 0.4748) * Futuri studenti
  * Studenti iscr...
3): (tokens: 396) (url: https://amm.units.it/en/placement/about-us) (score: 0.4729) * Prospective students
  * Enrolled...
4): (tokens: 281) (url: https://amm.units.it/normativa/regolamenti/articolo-22145/art-1-natura-e-fini) (score: 0.4674) 7\. L'Università promuove la qualit...
5): (tokens: 354) (url: https://amm.units.it/placement/chi-siamo) (score: 0.4639) * Futuri studenti
  * Studenti iscr...
6): (tokens: 254) (url: https://amm.units.it/placement/chi-siamo) (score: 0.4478) #### Servizi per le aziende

  * Pu...",pass,0.4772,https://amm.units.it/placement,,1.0,0.8218,0.9267,0.5
Quali forme di sostegno economico eroga l'Università agli studenti?,"L'Università eroga diverse forme di sostegno economico agli studenti. Offre borse di studio proprie, destinate a incentivare la frequenza universitaria e a supportare gli studenti in situazioni economiche difficili, promuovendo l'inclusione e valorizzando il talento. Inoltre, mette a disposizione moduli e documenti per richiedere esenzioni e riduzioni delle tasse universitarie, basate su specifiche situazioni personali, come ad esempio: *   Riduzioni per borsisti del Governo Italiano o studenti provenienti da Paesi in via di sviluppo. *   Riduzioni per familiari contemporaneamente iscritti. *   Esenzioni per figli di beneficiari di pensione di inabilità. *   Riduzioni per studenti genitori. *   Esenzioni/riduzioni per permessi di soggiorno per asilo politico o tutele speciali per studenti internazionali.","L'Università eroga diverse forme di sostegno economico agli studenti. Offre borse di studio proprie, destinate a incentivare la frequenza universitaria e a supportare chi si trova in situazioni economiche difficili, con l'obiettivo di promuovere l'inclusione e valorizzare il talento.

Inoltre, sono disponibili moduli e documenti per richiedere esenzioni e riduzioni delle tasse universitarie, basate su specifiche situazioni personali. Queste includono riduzioni per studenti provenienti da paesi in via di sviluppo, per borsisti del Governo Italiano o studenti da paesi in via di sviluppo, per famiglie con più membri iscritti contemporaneamente, per figli di beneficiari di pensione di inabilità, per studenti genitori e per studenti con permessi di soggiorno per asilo politico o altre tutele speciali.",https://amm.units.it/normativa/regolamenti/articolo-22145/art-1-natura-e-fini,"1): (tokens: 357) (url: https://lauree.units.it/it/0320107305200001/borse-di-studio) (score: 0.4931) Le borse di studio dell’Ateneo sono...
2): (tokens: 466) (url: https://degree.units.it/en/0320106204700003/university-fees) (score: 0.4925) A **contributions simulator** is av...
3): (tokens: 363) (url: https://lauree.units.it/it/0320107308800001/borse-di-studio) (score: 0.4902) Le borse di studio dell’Ateneo sono...
4): (tokens: 380) (url: https://lauree.units.it/it/0320107309500008/borse-di-studio) (score: 0.4893) Le borse di studio dell’Ateneo sono...
5): (tokens: 463) (url: https://lauree.units.it/it/0320107303800004/tasse-e-contributi) (score: 0.4889) 4 dell'Avviso. In alcuni casi dovrà...
6): (tokens: 345) (url: https://lauree.units.it/it/0320106204900002/borse-di-studio) (score: 0.4873) Grazie a queste opportunità, l’Univ...",pass,0.4931,https://lauree.units.it/it/0320107305200001/borse-di-studio,0.9969,1.0,0.9827,0.45,1.0
Chi può proporre il conferimento del titolo di Dottore di Ricerca honoris causa?,"Il conferimento può essere proposto dal Rettore o dal Collegio dei docenti del Dottorato di riferimento, previa deliberazione assunta con la maggioranza dei due terzi dei componenti.","Il conferimento del titolo di Dottore di Ricerca honoris causa può essere proposto dal Rettore o dal Collegio dei docenti del Dottorato di riferimento, previa deliberazione assunta con la maggioranza dei due terzi dei componenti.",https://amm.units.it/normativa/regolamenti/articolo-53336/art-37-dottore-ricerca-honoris-causa,"1): (tokens: 230) (url: https://amm.units.it/normativa/regolamenti/articolo-53336/art-37-dottore-ricerca-honoris-causa) (score: 0.5638) 6\. Il Rettore trasmette al Ministe...
2): (tokens: 454) (url: https://amm.units.it/normativa/regolamenti/articolo-53336/art-37-dottore-ricerca-honoris-causa) (score: 0.5446) * Futuri studenti
  * Studenti iscr...
3): (tokens: 361) (url: https://amm.units.it/normativa/regolamenti/articolo-22654/art-2-destinatari-assegni-ricerca) (score: 0.4829) 4\. Il possesso del titolo di dotto...
4): (tokens: 430) (url: https://amm.units.it/normativa/regolamenti/articolo-44580/art-25-valutazione-della-tesi-e-ammissione-all-esame-finale) (score: 0.4666) * Futuri studenti
  * Studenti iscr...
5): (tokens: 400) (url: https://phd.units.it/it/dot1333709/come-iscriversi) (score: 0.4548) ENG

Area dottorandi

  * Home
  * ...
6): (tokens: 435) (url: https://portale.units.it/it/ricerca/dottorati/carriera-studente) (score: 0.4513) * Futuri studenti
  * Studenti iscr...",pass,0.5638,https://amm.units.it/normativa/regolamenti/articolo-53336/art-37-dottore-ricerca-honoris-causa,0.9566,1.0,0.931,0.5,1.0
Quanti dottorati honoris causa può conferire l'Ateneo per ogni anno accademico?,"L'Ateneo può conferire al massimo un solo Dottorato honoris causa per ogni anno accademico, e comunque nei limiti stabiliti dal Ministero.","L'Ateneo può conferire al massimo un solo Dottorato honoris causa per ogni anno accademico, nel rispetto dei limiti stabiliti dal Ministero.",https://amm.units.it/normativa/regolamenti/articolo-53336/art-37-dottore-ricerca-honoris-causa,"1): (tokens: 230) (url: https://amm.units.it/normativa/regolamenti/articolo-53336/art-37-dottore-ricerca-honoris-causa) (score: 0.5211) 6\. Il Rettore trasmette al Ministe...
2): (tokens: 454) (url: https://amm.units.it/normativa/regolamenti/articolo-53336/art-37-dottore-ricerca-honoris-causa) (score: 0.4421) * Futuri studenti
  * Studenti iscr...
3): (tokens: 316) (url: https://phd.units.it/it/dot1333709/dottorandi) (score: 0.4357) ENG

Area dottorandi

  * Home
  * ...
4): (tokens: 421) (url: https://amm.units.it/normativa/regolamenti/articolo-44556/art-2-accreditamento-istituzione-e-attivazione-corsi) (score: 0.4262) 13\. Il Dipartimento può finanziare...
5): (tokens: 421) (url: https://amm.units.it/normativa/regolamenti/articolo-53335/art-36-riconoscimento-accademico-del-titolo-estero-dottorato) (score: 0.4228) 3327 dell’8 luglio 2022 in materia ...
6): (tokens: 473) (url: https://amm.units.it/normativa/regolamenti/articolo-44564/art-10-composizione-del-collegio-docenti) (score: 0.4197) 4\. Nel caso di dottorati attivati ...",pass,0.5211,https://amm.units.it/normativa/regolamenti/articolo-53336/art-37-dottore-ricerca-honoris-causa,0.9995,1.0,0.9568,1.0,1.0
Quali diritti attribuisce il diploma di Dottorato honoris causa?,"Il diploma di Dottorato honoris causa attribuisce tutti i diritti del Dottorato ordinario, in quanto è equiparato ex lege al titolo normalmente conseguito.","Il diploma di Dottorato honoris causa conferisce tutti i diritti del Dottorato ordinario, essendo equiparato per legge al titolo conseguito normalmente.",https://amm.units.it/normativa/regolamenti/articolo-53336/art-37-dottore-ricerca-honoris-causa,"1): (tokens: 230) (url: https://amm.units.it/normativa/regolamenti/articolo-53336/art-37-dottore-ricerca-honoris-causa) (score: 0.5530) 6\. Il Rettore trasmette al Ministe...
2): (tokens: 454) (url: https://amm.units.it/normativa/regolamenti/articolo-53336/art-37-dottore-ricerca-honoris-causa) (score: 0.4983) * Futuri studenti
  * Studenti iscr...
3): (tokens: 423) (url: https://amm.units.it/normativa/regolamenti/articolo-44582/art-27-diritti-e-doveri-dottorandi) (score: 0.4708) * Futuri studenti
  * Studenti iscr...
4): (tokens: 435) (url: https://portale.units.it/it/ricerca/dottorati/carriera-studente) (score: 0.4640) * Futuri studenti
  * Studenti iscr...
5): (tokens: 409) (url: https://amm.units.it/normativa/regolamenti/articolo-44582/art-27-diritti-e-doveri-dottorandi) (score: 0.4616) 7\. I dottorandi dell’area medica p...
6): (tokens: 231) (url: https://amm.units.it/normativa/regolamenti/articolo-44553/sommario) (score: 0.4585) 25 – Valutazione della tesi e ammis...",pass,0.553,https://amm.units.it/normativa/regolamenti/articolo-53336/art-37-dottore-ricerca-honoris-causa,0.9973,1.0,0.9053,1.0,1.0
"Secondo il regolamento, in quali casi una proposta di dottorato honoris causa non viene presa in considerazione?",Non vengono prese in considerazione le proposte inerenti a persone già in possesso di un diploma di Dottorato di Ricerca ordinario o honoris causa della stessa tipologia.,Le informazioni fornite non contengono dettagli sui regolamenti relativi alle proposte di dottorato honoris causa o sui casi in cui tali proposte non vengono prese in considerazione.,https://amm.units.it/normativa/regolamenti/articolo-53336/art-37-dottore-ricerca-honoris-causa,"1): (tokens: 134) (url: https://degree.units.it/en/0320106204600001/teaching-regulations) (score: 0.3984) ##### Inter-university

This course...
2): (tokens: 127) (url: https://degree.units.it/en/0320107300700001/students-area/regulations-and-documents) (score: 0.3968) ##### Inter-university

This course...
3): (tokens: 127) (url: https://lauree.units.it/en/0320107300700001/scholarship) (score: 0.3955) ##### Inter-university

This course...
4): (tokens: 134) (url: https://degree.units.it/en/0320106204700001/teaching-regulations) (score: 0.3926) ##### Inter-university

This course...
5): (tokens: 127) (url: https://degree.units.it/en/0320107304100001/teaching-regulations) (score: 0.3910) ##### Inter-university

This course...
6): (tokens: 134) (url: https://degree.units.it/en/0320106204700001/scholarship) (score: 0.3878) ##### Inter-university

This course...",fail,0.3984,https://degree.units.it/en/0320106204600001/teaching-regulations,0.2009,1.0,0.0,0.0,0.0
Per quanto tempo può essere incrementata la borsa di dottorato per soggiorno all'estero?,L'importo della borsa di dottorato può essere incrementato del 50% per un periodo di soggiorno all'estero complessivo non superiore a 12 mesi per attività di ricerca. Questo periodo può essere esteso fino a un massimo complessivo di 18 mesi per i dottorati in convenzione o per i dottorandi in co-tutela con soggetti esteri. L'incremento è applicabile per periodi di soggiorno continuativi e non inferiori a 30 giorni.,L'importo della borsa di dottorato può essere incrementato per un periodo di soggiorno all'estero complessivo non superiore a 12 mesi per attività di ricerca. Questo periodo può essere esteso fino a un massimo complessivo di 18 mesi per i dottorati in convenzione o per i dottorandi in co-tutela con soggetti esteri. L'incremento è dovuto per periodi di soggiorno continuativi e non inferiori a 30 giorni.,https://amm.units.it/normativa/regolamenti/articolo-44584/art-29-borse-studio,"1): (tokens: 472) (url: https://amm.units.it/normativa/regolamenti/articolo-44584/art-29-borse-studio) (score: 0.6306) * Futuri studenti
  * Studenti iscr...
2): (tokens: 426) (url: https://amm.units.it/normativa/regolamenti/articolo-44578/art-23-proroga-della-consegna-della-tesi-o-della-frequenza) (score: 0.5861) La borsa può essere corrisposta, fi...
3): (tokens: 476) (url: https://phd.units.it/it/dot1333171/borsa-di-dottorato) (score: 0.5309) ENG

Area dottorandi

  * Home
  * ...
4): (tokens: 461) (url: https://phd.units.it/it/dot1333709/borsa-di-dottorato) (score: 0.5261) ENG

Area dottorandi

  * Home
  * ...
5): (tokens: 464) (url: https://phd.units.it/it/dot1633978/borsa-di-dottorato) (score: 0.5168) ENG

Area dottorandi

  * Home
  * ...
6): (tokens: 459) (url: https://amm.units.it/normativa/regolamenti/articolo-44578/art-23-proroga-della-consegna-della-tesi-o-della-frequenza) (score: 0.5156) * Futuri studenti
  * Studenti iscr...",fail,0.6306,https://amm.units.it/normativa/regolamenti/articolo-44584/art-29-borse-studio,0.9215,1.0,0.9194,1.0,1.0
regole e limitazioni per ottenere una seconda borsa di dottorato nell'università italiana,"Chi ha già usufruito di una borsa di dottorato nell'ambito del sistema universitario italiano, anche parzialmente, non può usufruirne una seconda volta.","Non è possibile usufruire di una seconda borsa di dottorato nell'ambito del sistema universitario italiano se si è già beneficiato di una borsa in precedenza, anche solo parzialmente o per un singolo anno.",https://amm.units.it/normativa/regolamenti/articolo-44584/art-29-borse-studio,"1): (tokens: 408) (url: https://amm.units.it/normativa/regolamenti/articolo-44584/art-29-borse-studio) (score: 0.5148) 5\. Chi ha già usufruito di una bor...
2): (tokens: 400) (url: https://amm.units.it/normativa/regolamenti/articolo-44584/art-29-borse-studio) (score: 0.4830) Il finanziamento può essere riutili...
3): (tokens: 472) (url: https://amm.units.it/normativa/regolamenti/articolo-44572/art-18-ammissione-ai-corsi) (score: 0.4813) 5\. Il bando può altresì prevedere ...
4): (tokens: 472) (url: https://amm.units.it/normativa/regolamenti/articolo-44584/art-29-borse-studio) (score: 0.4723) * Futuri studenti
  * Studenti iscr...
5): (tokens: 284) (url: https://phd.units.it/it/dot1333171/borsa-di-dottorato) (score: 0.4719) ** A parità di merito prevale la va...
6): (tokens: 421) (url: https://amm.units.it/normativa/regolamenti/articolo-44556/art-2-accreditamento-istituzione-e-attivazione-corsi) (score: 0.4681) 13\. Il Dipartimento può finanziare...",pass,0.5148,https://amm.units.it/normativa/regolamenti/articolo-44584/art-29-borse-studio,0.9784,1.0,0.701,0.7,1.0
"Cosa succede alla borsa di dottorato in caso di rinuncia, di mancato rinnovo o di rinuncia agli studi?","In caso di rinuncia alla borsa, di mancato rinnovo o di rinuncia agli studi, la borsa può essere assegnata, nella sua quota totale o residua, su proposta del Collegio dei docenti, a un dottorando privo di borsa dello stesso ciclo e dello stesso Corso. In ogni caso l'importo non utilizzato è reinvestito dal soggetto che ha attivato il Corso per il finanziamento di dottorati di ricerca.","In caso di rinuncia alla borsa, di mancato rinnovo della borsa o di rinuncia agli studi, l'erogazione della borsa o di qualsiasi altra forma di sostegno economico equivalente fornita dall'Università e legata alla frequenza del dottorato viene immediatamente interrotta.

La borsa, nella sua quota totale o residua, può essere assegnata, su proposta del Collegio dei docenti, a un dottorando privo di borsa dello stesso ciclo e dello stesso Corso, seguendo la relativa graduatoria e tenendo conto di eventuali idoneità per le borse a tema vincolato. L'importo della borsa non utilizzato viene reinvestito dal soggetto che ha attivato il Corso per il finanziamento di dottorati di ricerca. Tale finanziamento può essere riutilizzato previo accordo tra le parti o se le condizioni del finanziamento stesso lo prevedono.",https://amm.units.it/normativa/regolamenti/articolo-44584/art-29-borse-studio,"1): (tokens: 408) (url: https://amm.units.it/normativa/regolamenti/articolo-44584/art-29-borse-studio) (score: 0.5891) 5\. Chi ha già usufruito di una bor...
2): (tokens: 400) (url: https://amm.units.it/normativa/regolamenti/articolo-44584/art-29-borse-studio) (score: 0.5354) Il finanziamento può essere riutili...
3): (tokens: 461) (url: https://phd.units.it/it/dot1333709/borsa-di-dottorato) (score: 0.5120) ENG

Area dottorandi

  * Home
  * ...
4): (tokens: 472) (url: https://amm.units.it/normativa/regolamenti/articolo-44584/art-29-borse-studio) (score: 0.5086) * Futuri studenti
  * Studenti iscr...
5): (tokens: 466) (url: https://amm.units.it/normativa/regolamenti/articolo-44579/art-24-decadenza-esclusione-e-rinuncia-agli-studi) (score: 0.5082) Regolamento in materia di Dottorato...
6): (tokens: 426) (url: https://amm.units.it/normativa/regolamenti/articolo-44578/art-23-proroga-della-consegna-della-tesi-o-della-frequenza) (score: 0.5078) La borsa può essere corrisposta, fi...",pass,0.5891,https://amm.units.it/normativa/regolamenti/articolo-44584/art-29-borse-studio,0.7705,0.8421,0.6805,1.0,1.0
Quali conseguenze può avere il rifiuto del dottorando di dedicarsi al tema di ricerca assegnato?,"Il Collegio dei docenti, sentito il dottorando, può disporre la decadenza dal dottorato oppure la revoca della borsa e l'attribuzione al dottorando di un nuovo tema di ricerca e di un nuovo supervisore, senza prolungamento della durata di 36 mesi del dottorato.","Qualora un dottorando non intenda più dedicarsi al tema di ricerca assegnato o collaborare con il gruppo di ricerca e i supervisori, il Collegio dei docenti, dopo aver sentito il dottorando, può disporre la decadenza dal dottorato. In alternativa, può revocare la borsa di studio e assegnare al dottorando un nuovo tema di ricerca e un nuovo supervisore, senza che ciò comporti un prolungamento della durata di 36 mesi del dottorato.",https://amm.units.it/normativa/regolamenti/articolo-44584/art-29-borse-studio,"1): (tokens: 466) (url: https://amm.units.it/normativa/regolamenti/articolo-44579/art-24-decadenza-esclusione-e-rinuncia-agli-studi) (score: 0.4756) Regolamento in materia di Dottorato...
2): (tokens: 319) (url: https://amm.units.it/normativa/regolamenti/articolo-44577/art-22-sospensione-studi) (score: 0.4365) 3\. Il Collegio dei docenti può inf...
3): (tokens: 408) (url: https://amm.units.it/normativa/regolamenti/articolo-44584/art-29-borse-studio) (score: 0.4273) 5\. Chi ha già usufruito di una bor...
4): (tokens: 423) (url: https://amm.units.it/normativa/regolamenti/articolo-44582/art-27-diritti-e-doveri-dottorandi) (score: 0.4197) * Futuri studenti
  * Studenti iscr...
5): (tokens: 400) (url: https://amm.units.it/normativa/regolamenti/articolo-44584/art-29-borse-studio) (score: 0.4184) Il finanziamento può essere riutili...
6): (tokens: 230) (url: https://amm.units.it/normativa/regolamenti/articolo-53336/art-37-dottore-ricerca-honoris-causa) (score: 0.4136) 6\. Il Rettore trasmette al Ministe...",pass,0.4756,https://amm.units.it/normativa/regolamenti/articolo-44579/art-24-decadenza-esclusione-e-rinuncia-agli-studi,0.8395,1.0,0.708,0.2,1.0
Quali sono gli insegnamenti previsti nel semestre aperto per l'accesso a Medicina e Odontoiatria?,"Il semestre aperto prevede la frequenza e il superamento di tre insegnamenti da 6 CFU ciascuno: Chimica e propedeutica biochimica, Fisica e Biologia.","Gli insegnamenti previsti nel semestre aperto per l'accesso a Medicina e Odontoiatria sono:

*   Chimica e propedeutica biochimica
*   Fisica
*   Biologia",https://portale.units.it/it/studiare/orientarsi/preparazione-test-area-medico-sanitaria,"1): (tokens: 445) (url: https://portale.units.it/it/studiare/orientarsi/preparazione-test-area-medico-sanitaria) (score: 0.5989) * Futuri studenti
  * Studenti iscr...
2): (tokens: 227) (url: https://lauree.units.it/it/0320107304700001/semestre-aperto/lezioni) (score: 0.5853) ENG

Area studenti

  * Home
  * Il...
3): (tokens: 218) (url: https://lauree.units.it/it/0320107304700001/semestre-aperto) (score: 0.5685) ENG

Area studenti

  * Home
  * Il...
4): (tokens: 387) (url: https://portale.units.it/it/studiare/orientarsi/preparazione-test-area-medico-sanitaria) (score: 0.5423) ## **Perfezionamento immatricolazio...
5): (tokens: 213) (url: https://lauree.units.it/it/0320107304200001/semestre-aperto) (score: 0.5420) ENG

Area studenti

  * Home
  * Il...
6): (tokens: 479) (url: https://lauree.units.it/it/0320107304700001/semestre-aperto) (score: 0.5234) I risultati ottenuti agli esami det...",fail,0.5989,https://portale.units.it/it/studiare/orientarsi/preparazione-test-area-medico-sanitaria,0.6341,1.0,1.0,0.95,1.0
Qual è il contributo economico richiesto per l'iscrizione al semestre aperto di Medicina?,Per l'iscrizione al semestre aperto è previsto un contributo forfettario unico a livello nazionale di 250 euro. L'importo verrà ricalcolato in un secondo momento in base all'ISEE Universitario e agli altri casi di esonero totale o parziale previsti dalla normativa vigente.,Il contributo economico richiesto per l'iscrizione al semestre aperto è di 250 Euro. Questo importo è un contributo forfettario unico a livello nazionale.,https://portale.units.it/it/studiare/orientarsi/preparazione-test-area-medico-sanitaria,"1): (tokens: 213) (url: https://lauree.units.it/it/0320107304200001/semestre-aperto) (score: 0.5410) ENG

Area studenti

  * Home
  * Il...
2): (tokens: 414) (url: https://lauree.units.it/it/0320107304200001/semestre-aperto/come-iscriversi) (score: 0.5383) Iscrizione in UniTS
    

 _Per pro...
3): (tokens: 432) (url: https://lauree.units.it/it/0320107304200001/semestre-aperto/lezioni) (score: 0.5221) Obbligo e modalità di frequenza
   ...
4): (tokens: 387) (url: https://portale.units.it/it/studiare/orientarsi/preparazione-test-area-medico-sanitaria) (score: 0.5172) ## **Perfezionamento immatricolazio...
5): (tokens: 414) (url: https://lauree.units.it/it/0320107304700001/semestre-aperto/come-iscriversi) (score: 0.5132) Iscrizione in UniTS
    

 _Per pro...
6): (tokens: 395) (url: https://lauree.units.it/it/0320107304200001/semestre-aperto/immatricolazione) (score: 0.5056) **Dopo** l’iscrizione al concorso e...",pass,0.541,https://lauree.units.it/it/0320107304200001/semestre-aperto,0.6024,1.0,0.8981,0.5333,1.0
Cosa succede a chi non risulta in posizione utile in graduatoria dopo il semestre aperto di Medicina?,"Chi non risulta in posizione utile in graduatoria può accedere, sulla base della posizione raggiunta e dei posti disponibili, al corso affine scelto in fase di iscrizione.","Se uno studente non risulta in posizione utile nella graduatoria per il corso di Medicina dopo il semestre aperto, ma ha ottenuto almeno 18/30 in tutti e tre gli esami, può immatricolarsi al secondo semestre di un corso affine. Questa possibilità è offerta nei limiti del 20% di posti aggiuntivi riservati ai corsi a numero programmato, e i crediti (CFU) conseguiti nel semestre aperto verranno riconosciuti integralmente. La scelta del corso affine segue l'ordine di preferenza indicato dal candidato.

Nel caso in cui lo studente non venga ammesso al secondo semestre del corso di laurea prescelto o di un corso affine, ha due ulteriori possibilità:
1. Ripetere il semestre aperto, fino a un massimo di tre volte, anche in anni accademici non consecutivi.
2. Iscriversi a un altro corso di studio, a condizione di rispettare i requisiti di accesso previsti (come il test TOLC) e la disponibilità di posti. L'eventuale riconoscimento dei CFU già acquisiti sarà valutato dal nuovo corso di laurea.",https://portale.units.it/it/studiare/orientarsi/preparazione-test-area-medico-sanitaria,"1): (tokens: 478) (url: https://lauree.units.it/it/0320107304200001/come-iscriversi) (score: 0.4652) **Requisito minimo di accesso**  
P...
2): (tokens: 420) (url: https://degree.units.it/en/0320107304700001/how-apply) (score: 0.4463) may enrol in the second semester of...
3): (tokens: 232) (url: https://lauree.units.it/it/0320107304200001/semestre-aperto/lezioni) (score: 0.4395) Valutazione della didattica
    

A...
4): (tokens: 444) (url: https://lauree.units.it/it/0320107304200001/come-iscriversi) (score: 0.4297) Vedi l’Offerta formativa UniTS

###...
5): (tokens: 476) (url: https://lauree.units.it/it/0320107304200001/come-iscriversi) (score: 0.4270) #### Anni successivi al primo

Il B...
6): (tokens: 475) (url: https://lauree.units.it/it/0320107304200001/semestre-aperto) (score: 0.4219) I risultati ottenuti agli esami det...",pass,0.4652,https://lauree.units.it/it/0320107304200001/come-iscriversi,0.4007,1.0,0.7276,0.8333,1.0
Quante ore minime di tirocinio pratico-valutativo sono richieste come primo operatore in Odontoiatria?,"Il tirocinio pratico-valutativo di Odontoiatria richiede un minimo di 600 ore di tirocinio come primo operatore, certificate dal Coordinatore del Corso di Studio.",Sono richieste almeno 600 ore di tirocinio pratico-valutativo come primo operatore.,https://lauree.units.it/it/0320107304700001/area-studenti/tirocinio-e-internato,"1): (tokens: 132) (url: https://lauree.units.it/it/0320107304700001/area-studenti/tirocinio-e-internato) (score: 0.5713) Procedure
    

Le attività̀ del TP...
2): (tokens: 472) (url: https://lauree.units.it/it/0320107304700001/area-studenti/tirocinio-e-internato) (score: 0.5006) Le competenze cliniche acquisite ve...
3): (tokens: 456) (url: https://lauree.units.it/it/0320107304700001/area-studenti/tirocinio-e-internato) (score: 0.4937) ENG

Area studenti

  * Home
  * Il...
4): (tokens: 424) (url: https://degree.units.it/it/0320106204800001/area-studenti/insegnamenti/2025/115474/2017/9999/10333/2023/) (score: 0.4894) ## 

Il tirocinio è un corso conven...
5): (tokens: 439) (url: https://lauree.units.it/it/0320106204700002/area-studenti/insegnamenti/2025/120670/2024/9999/10476/2025/13228) (score: 0.4785) ## 

Il tirocinio del I anno preved...
6): (tokens: 465) (url: https://lauree.units.it/it/0320106204800001-1/area-studenti/tirocinio-e-internato) (score: 0.4722) Laurea 

# IGIENE DENTALE

ABILITAN...",pass,0.5713,https://lauree.units.it/it/0320107304700001/area-studenti/tirocinio-e-internato,0.701,1.0,0.8602,1.0,1.0
In cosa consiste la prova pratica valutativa al termine del tirocinio di Odontoiatria?,"La prova pratica valutativa consiste nella discussione di 3 casi clinici multidisciplinari svolti dal candidato, con valutazione idoneo/non idoneo. Precede la discussione della tesi di laurea.","Al termine del tirocinio pratico-valutativo, la prova pratica valutativa consiste nella discussione di tre casi clinici multidisciplinari svolti dal candidato, con una valutazione di idoneità o non idoneità. Questa prova precede la discussione della tesi di laurea.",https://lauree.units.it/it/0320107304700001/area-studenti/tirocinio-e-internato,"1): (tokens: 393) (url: https://lauree.units.it/it/0320107304700001/area-studenti/tirocinio-e-internato) (score: 0.5795) Prova pratica valutativa PPV
    

...
2): (tokens: 472) (url: https://lauree.units.it/it/0320107304700001/area-studenti/tirocinio-e-internato) (score: 0.5291) Le competenze cliniche acquisite ve...
3): (tokens: 425) (url: https://lauree.units.it/it/0320107304700001/il-corso) (score: 0.5219) L'apprendimento viene valutato attr...
4): (tokens: 425) (url: https://degree.units.it/en/0320107304700001/course) (score: 0.5210) L'apprendimento viene valutato attr...
5): (tokens: 172) (url: https://degree.units.it/en/0320107304700001/course) (score: 0.5154) L'apprendimento viene valutato attr...
6): (tokens: 456) (url: https://lauree.units.it/it/0320107304700001/area-studenti/tirocinio-e-internato) (score: 0.5148) ENG

Area studenti

  * Home
  * Il...",pass,0.5795,https://lauree.units.it/it/0320107304700001/area-studenti/tirocinio-e-internato,0.8989,1.0,0.7713,1.0,1.0
Come si registra il tirocinio da 9 CFU in Fisica?,"Per registrare il tirocinio da 9 CFU in Fisica, lo studente deve esporre l'attività svolta e i risultati raggiunti in un seminario pubblico di 20 minuti. Bisogna contattare il Prof. Andrea Bressan per l'iscrizione all'appello che si tiene ogni primo lunedì del mese.","Per registrare il tirocinio da 9 CFU, è necessario esporre l'attività svolta e i risultati raggiunti in un seminario pubblico della durata di 20 minuti. Per l'iscrizione online all'appello, che si tiene ogni primo lunedì del mese, occorre contattare il Prof. Andrea Bressan all'indirizzo ANDREA.BRESSAN@units.it.",https://lauree.units.it/it/0320106203000001/area-studenti/tirocinio-e-internato,"1): (tokens: 478) (url: https://lauree.units.it/it/0320106203000001/area-studenti/tirocinio-e-internato) (score: 0.4827) Se la struttura ospitante ti richie...
2): (tokens: 486) (url: https://lauree.units.it/it/0320107301800010/area-studenti/tirocinio-e-internato) (score: 0.4770) ENG

Area studenti

  * Home
  * Il...
3): (tokens: 381) (url: https://lauree.units.it/it/0320106202700001/area-studenti/tirocinio-e-internato) (score: 0.4671) **Conclusione e riconoscimento CFU*...
4): (tokens: 360) (url: https://lauree.units.it/it/0320106203000001/area-studenti/tirocinio-e-internato) (score: 0.4669) Contatta il Prof. Andrea Bressan (A...
5): (tokens: 484) (url: https://lauree.units.it/it/0320107302500001/area-studenti/tirocinio-e-internato) (score: 0.4628) * Nel compilare il Progetto Formati...
6): (tokens: 443) (url: https://lauree.units.it/it/0320106202700001/area-studenti/tirocinio-e-internato) (score: 0.4512) ENG

Area studenti

  * Home
  * Il...",pass,0.4827,https://lauree.units.it/it/0320106203000001/area-studenti/tirocinio-e-internato,0.8569,1.0,0.7724,1.0,1.0
Quanti CFU prevede il tirocinio curriculare di Fisica e quante ore corrispondono?,Il tirocinio curriculare di Fisica prevede 3 CFU per un totale di 75 ore. In alternativa è possibile optare per un tirocinio esteso da 9 CFU per 225 ore. Per gli immatricolati al primo anno a partire dall'a.a. 2024/2025 è previsto solamente il tirocinio da 3 CFU.,"Il tirocinio curriculare di Fisica prevede 3 CFU, corrispondenti a un totale di 75 ore.",https://lauree.units.it/it/0320106203000001/area-studenti/tirocinio-e-internato,"1): (tokens: 478) (url: https://lauree.units.it/it/0320106203000001/area-studenti/tirocinio-e-internato) (score: 0.6222) Se la struttura ospitante ti richie...
2): (tokens: 289) (url: https://lauree.units.it/it/0320106203900001/area-studenti/tirocinio-e-internato) (score: 0.5836) Il numero di CFU richiesti è defini...
3): (tokens: 443) (url: https://lauree.units.it/it/0320106202700001/area-studenti/tirocinio-e-internato) (score: 0.5694) ENG

Area studenti

  * Home
  * Il...
4): (tokens: 486) (url: https://lauree.units.it/it/0320107301800010/area-studenti/tirocinio-e-internato) (score: 0.5659) ENG

Area studenti

  * Home
  * Il...
5): (tokens: 464) (url: https://lauree.units.it/it/0320106204800004/area-studenti/tirocinio-e-internato) (score: 0.5556) Le sedi e le modalità di frequenza ...
6): (tokens: 465) (url: https://lauree.units.it/it/0320106204700002/area-studenti/tirocinio-e-internato) (score: 0.5416) Il regolare svolgimento del Tirocin...",fail,0.6222,https://lauree.units.it/it/0320106203000001/area-studenti/tirocinio-e-internato,0.6064,0.0,0.9869,1.0,0.0
Entro quando deve arrivare la documentazione per avviare il tirocinio di Scienze e Tecnologie Biologiche?,"La documentazione per avviare il tirocinio di Scienze e Tecnologie Biologiche deve arrivare alla Segreteria Didattica entro il 15 del mese precedente l'inizio del tirocinio, per permettere l'approvazione da parte del Consiglio di Corso di Studi.",La documentazione per avviare il tirocinio deve pervenire alla Segreteria Didattica entro il 15 del mese precedente l'inizio del tirocinio.,https://lauree.units.it/it/0320106201300002/area-studenti/tirocinio-e-internato,"1): (tokens: 412) (url: https://lauree.units.it/it/0320107301400001/area-studenti/tirocinio-e-internato) (score: 0.5480) Procedura e documentazione
    

De...
2): (tokens: 411) (url: https://lauree.units.it/it/0320107308800001/area-studenti/tirocinio-e-internato) (score: 0.5459) I documenti devono essere inviati *...
3): (tokens: 274) (url: https://lauree.units.it/it/0320106201300002/area-studenti/tirocinio-e-internato) (score: 0.5449) Le altre aziende sanitarie ASUFC e ...
4): (tokens: 444) (url: https://lauree.units.it/it/0320106203200001/area-studenti/tirocinio-e-internato) (score: 0.5353) **Accordati con il tutore interno (...
5): (tokens: 446) (url: https://lauree.units.it/it/0320106201100001/area-studenti/tirocinio-e-internato) (score: 0.5346) #### Importante 

Senza la consegna...
6): (tokens: 446) (url: https://lauree.units.it/it/0320106200500002/area-studenti/tirocinio-e-internato) (score: 0.5289) #### Importante 

Senza la consegna...",pass,0.548,https://lauree.units.it/it/0320107301400001/area-studenti/tirocinio-e-internato,0.8103,0.0,0.7243,0.3333,1.0
Quando è richiesto il test Mantoux per il tirocinio di Scienze e Tecnologie Biologiche?,"Il test Mantoux è richiesto quando il tirocinio prevede il contatto con persone fragili, come in strutture quali asili nidi, scuole dell'infanzia, ospedali, cliniche, case di riposo o centri di accoglienza. L'ateneo ha una convenzione con ASUGI per effettuare il test gratuitamente.","Il test Mantoux è richiesto se l'attività di tirocinio o internato prevede il contatto con persone fragili. Questo include contesti come asili nido, scuole dell'infanzia e primarie, ospedali, cliniche, case di riposo e centri di accoglienza.",https://lauree.units.it/it/0320106201300002/area-studenti/tirocinio-e-internato,"1): (tokens: 404) (url: https://lauree.units.it/it/0320106202400001/area-studenti/tirocinio-e-internato) (score: 0.5792) Nel caso in cui l'attività di Tiroc...
2): (tokens: 393) (url: https://lauree.units.it/it/0320106203200001/area-studenti/tirocinio-e-internato) (score: 0.5642) ** L'ateneo ha una convenzione con ...
3): (tokens: 471) (url: https://lauree.units.it/it/0320106201300002/area-studenti/tirocinio-e-internato) (score: 0.5562) **Invia il modulo compilato** alla ...
4): (tokens: 347) (url: https://degree.units.it/it/0320107335200001/area-studenti/tirocinio-e-internato) (score: 0.5448) Il tirocinio deve essere supervisio...
5): (tokens: 347) (url: https://lauree.units.it/it/0320107305200001/area-studenti/tirocinio-e-internato) (score: 0.5418) Il tirocinio deve essere supervisio...
6): (tokens: 366) (url: https://lauree.units.it/it/0320107300700004/area-studenti/tirocinio-e-internato) (score: 0.5143) **Presentazione della domanda**
   ...",fail,0.5792,https://lauree.units.it/it/0320106202400001/area-studenti/tirocinio-e-internato,0.8648,1.0,0.8196,0.81,1.0
l aula T dell'edificio A è libera il giorno 20 marzo 2026?,Non ho informazioni sulla disponibilità dell'aula T per quella data specifica.,Non ci sono informazioni disponibili riguardo all'aula T dell'edificio A o alla sua disponibilità per il 20 marzo 2026.,absent for choice,"1): (tokens: 407) (url: https://degree.units.it/en/0320106204700003/students-area/graduation/graduation-specific-information) (score: 0.3967) Extraordinary session
    

Submiss...
2): (tokens: 377) (url: https://degree.units.it/it/0320106204700003/area-studenti/laurea/laurea-info-specifiche) (score: 0.3883) Sessione straordinaria
    

Invio ...
3): (tokens: 483) (url: https://portale.units.it/it/ateneo/campus/trieste/piazzale-europa-polo/aula-informatica) (score: 0.3873) * Futuri studenti
  * Studenti iscr...
4): (tokens: 455) (url: https://degree.units.it/en/0320106204700003/students-area/exams) (score: 0.3864) ITA

Student area

  * Home
  * The...
5): (tokens: 170) (url: https://portale.units.it/en/notice-board/units-merchandising-stand-back-friday-january-24th-atrium-h3) (score: 0.3828) * Prospective students
  * Enrolled...
6): (tokens: 396) (url: https://portale.units.it/en/notice-board?page=44) (score: 0.3826) A) riapre H24

11 Apr 

Dal 15 apri...",pass,0.3967,https://degree.units.it/en/0320106204700003/students-area/graduation/graduation-specific-information,0.7084,1.0,0.0,0.2667,1.0
dimmi i corsi disponibili del dipartimento di musicologia,Non dispongo di informazioni sui corsi del dipartimento di Musicologia.,"Le informazioni fornite non elencano corsi specifici offerti da un dipartimento di musicologia. Viene menzionato il corso ""Filosofie della Musica"" nell'ambito del corso di Laurea Magistrale in Filosofia.",absent for choice,"1): (tokens: 294) (url: https://lauree.units.it/it/0320107301000001/area-studenti/scelta-piano-di-studi/descrizione-piano-di-studi) (score: 0.4311) Ogni anno, gli insegnamenti a scelt...
2): (tokens: 222) (url: https://lauree.units.it/it/0320107307900001/area-studenti/insegnamenti/2025/115671/2025/9999/10816/2025/13154) (score: 0.4267) Area studenti

  * Home
  * Il cors...
3): (tokens: 405) (url: https://degree.units.it/it/0320106204700003/area-studenti/scelta-piano-di-studi/descrizione-piano-di-studi) (score: 0.4259) > **Gli insegnamenti obbligatori so...
4): (tokens: 423) (url: https://lauree.units.it/it/0320107307900001/area-studenti/insegnamenti/2025/115671/2025/9999/10816/2025/13154) (score: 0.4225) Curricula:  FILOSOFIA

     MARTINE...
5): (tokens: 403) (url: https://lauree.units.it/it/0320106204800009/area-studenti/scelta-piano-di-studi/descrizione-piano-di-studi) (score: 0.4207) > **Gli insegnamenti obbligatori so...
6): (tokens: 468) (url: https://lauree.units.it/it/0320106204800010/area-studenti/scelta-piano-di-studi/descrizione-piano-di-studi) (score: 0.4201) Puoi anche proporre attività format...",pass,0.4311,https://lauree.units.it/it/0320107301000001/area-studenti/scelta-piano-di-studi/descrizione-piano-di-studi,0.5621,1.0,0.8055,0.5,1.0
