question,ground_truth,answer,answer_source,contexts,judge_result,top_chunk_score,top_chunk_src,faithfulness,context_precision
l aula T dell'edificio A è libera il giorno 20 marzo 2026?,Non ho informazioni sulla disponibilità dell'aula T per quella data specifica.,Non ci sono informazioni disponibili riguardo alla disponibilità dell'aula T dell'edificio A per il giorno 20 marzo 2026.,absent for choice,"1): (tokens: 928) (url: https://portale.units.it/it/studiare/post-lauream/formazione-insegnanti/60cfu) (score: 0.4139) ## BACHECA AVVISI a.a. 2025/2026 

...
2): (tokens: 265) (url: https://degree.units.it/en/0320106204800001/students-area/exams) (score: 0.3968) # Exams: general info

Academic Yea...
3): (tokens: 87) (url: https://portale.units.it/it/internazionale/progetti/erasmus-ka-171/studenti-entrata) (score: 0.3964) ## WELCOME DAY 19th February 2026, ...
4): (tokens: 265) (url: https://degree.units.it/en/0320106204700003/students-area/exams) (score: 0.3949) # Exams: general info

Academic Yea...",pass,0.4139,https://portale.units.it/it/studiare/post-lauream/formazione-insegnanti/60cfu,1.0,1.0
dimmi i corsi disponibili del dipartimento di musicologia,Non dispongo di informazioni sui corsi del dipartimento di Musicologia.,"Le informazioni sui corsi disponibili del dipartimento di musicologia non sono presenti. I corsi menzionati sono offerti dal Dipartimento Universitario Clinico di Scienze mediche, chirurgiche e della salute - DSM.",absent for choice,"1): (tokens: 35) (url: https://degree.units.it/it/0320106204700003/area-studenti/insegnamenti/2025/120807-1/2022/9999/10505/2025) (score: 0.4670) ##### Dipartimento

Il corso è offe...
2): (tokens: 35) (url: https://degree.units.it/it/0320106204700003/area-studenti/insegnamenti/2025/120683/2022/9999/10505/2025/13231) (score: 0.4665) ##### Dipartimento

Il corso è offe...
3): (tokens: 35) (url: https://degree.units.it/it/0320106204700003/area-studenti/insegnamenti/2025/120683/2022/9999/10505/2023) (score: 0.4665) ##### Dipartimento

Il corso è offe...
4): (tokens: 35) (url: https://degree.units.it/it/0320106204700003/area-studenti/insegnamenti/2025/121241/2022/9999/10505/2025) (score: 0.4602) ##### Dipartimento

Il corso è offe...",pass,0.467,https://degree.units.it/it/0320106204700003/area-studenti/insegnamenti/2025/120807-1/2022/9999/10505/2025,1.0,1.0
Aula più grande in assoluto dell'università,Non dispongo di informazioni sulla dimensione delle aule dell'università.,Non è possibile determinare l'aula più grande dell'università in base alle informazioni fornite.,absent for choice,"1): (tokens: 17) (url: https://degree.units.it/en/0320107311900002) (score: 0.4216) ##### Teaching modality

The lectur...
2): (tokens: 17) (url: https://degree.units.it/en/0320107304100001/students-area/taught-courses/2025/119225/2025/3/10801/2025/13030) (score: 0.4176) ##### Teaching modality

The lectur...
3): (tokens: 17) (url: https://degree.units.it/en/0320107304100001/students-area/taught-courses/2025/118165/2025/2/10801/2025/13029) (score: 0.4168) ##### Teaching modality

The lectur...
4): (tokens: 17) (url: https://degree.units.it/en/0320107304100001/students-area/taught-courses/2025/118165/2025/1/10801/2025/13028) (score: 0.4168) ##### Teaching modality

The lectur...",pass,0.4216,https://degree.units.it/en/0320107311900002,1.0,0.0
dove si trova l'edificio H7?,non è possibile indicarne la posizione.,Non è possibile determinare la posizione dell'edificio H7 con le informazioni fornite.,absent for choice,"1): (tokens: 26) (url: https://lauree.units.it/it/0320107311900002) (score: 0.3297) ##### Sede

La sede di svolgimento ...
2): (tokens: 26) (url: https://lauree.units.it/it/0320107311900002/organi-e-referenti) (score: 0.3145) ##### Sede

La sede di svolgimento ...
3): (tokens: 26) (url: https://lauree.units.it/it/0320107311900002/area-studenti/laurea) (score: 0.3130) ##### Sede

La sede di svolgimento ...
4): (tokens: 26) (url: https://lauree.units.it/it/0320107311900002/come-iscriversi) (score: 0.3126) ##### Sede

La sede di svolgimento ...",pass,0.3297,https://lauree.units.it/it/0320107311900002,1.0,0.5833
Date di laurea 2027 per la sessione estiva di Scienze e Tecnologie Biologiche,i documenti a disposizione non riportano le date della sessione estiva di laurea per il 2027,Le informazioni fornite non contengono le date di laurea per la sessione estiva del 2027 relative al corso di Scienze e Tecnologie Biologiche.,absent for choice,"1): (tokens: 500) (url: https://lauree.units.it/it/0320106204800004/area-studenti/laurea/laurea-info-specifiche) (score: 0.4782) ### Appelli e scadenze

Le date deg...
2): (tokens: 25) (url: https://lauree.units.it/it/0320106201300002/area-studenti/insegnamenti/2027/118846/2025/9999/10793/2025/13313) (score: 0.4779) # BIOTECNOLOGIE CELLULARI

[027SV] ...
3): (tokens: 366) (url: https://lauree.units.it/it/0320106204800004/area-studenti/appelli-esame) (score: 0.4703) # Appelli d'esame

Anno Accademico ...
4): (tokens: 20) (url: https://lauree.units.it/it/0320106201300002/area-studenti/insegnamenti/2027/114051/2025/9999/10793/2025/13312) (score: 0.4643) # TIROCINIO

[857SM] 

a.a. 2027/20...",pass,0.4782,https://lauree.units.it/it/0320106204800004/area-studenti/laurea/laurea-info-specifiche,1.0,1.0
Argomenti dell'insegnamento di Reti Stradali del corsi di Urbanistica,Nel materiale a disposizione non sono presenti descrizioni o elenchi degli argomenti trattati nell’insegnamento “Reti Stradali” del corso di Urbanistica.,Le informazioni fornite non contengono dettagli sugli argomenti dell'insegnamento di Reti Stradali del corsi di Urbanistica.,absent for choice,"1): (tokens: 17) (url: https://degree.units.it/en/0320107308000002/students-area/taught-courses/2025/119309/2023/9999/10655/2024/13060) (score: 0.4321) ##### Teaching modality

The lectur...
2): (tokens: 17) (url: https://degree.units.it/en/0320107308000002/students-area/taught-courses/2025/119552/2023/9999/10655/2024/13060) (score: 0.4276) ##### Teaching modality

The lectur...
3): (tokens: 17) (url: https://degree.units.it/en/0320107308000002/students-area/taught-courses/2025/119549/2023/9999/10655/2024/13060) (score: 0.4260) ##### Teaching modality

The lectur...
4): (tokens: 17) (url: https://degree.units.it/en/0320107308000002/students-area/app) (score: 0.4209) ##### Teaching modality

The lectur...",pass,0.4321,https://degree.units.it/en/0320107308000002/students-area/taught-courses/2025/119309/2023/9999/10655/2024/13060,1.0,1.0
Che lezioni ci sono di lunedì per il corso di odontoiatria 2 anno nel primo semestre?,Nel materiale a disposizione non sono presenti informazioni a riguardo,"Le informazioni fornite non contengono dettagli sulle lezioni del lunedì per il secondo anno, primo semestre del corso di odontoiatria.",absent for choice,"1): (tokens: 172) (url: https://degree.units.it/it/0320106204800001/area-studenti/insegnamenti/2025/121259-4/2025/9999/10792/2025/13237) (score: 0.5056) ##  1° Anno - Secondo Semestre 

Fr...
2): (tokens: 138) (url: https://degree.units.it/it/0320106204800001/area-studenti/insegnamenti/2025/115742-1/2017/9999/10333/2023) (score: 0.5047) ##  Secondo Semestre 

Frequenza Ob...
3): (tokens: 241) (url: https://degree.units.it/en/0320106204800001/students-area/taught-courses/2025/115472/2017/9999/10333/2025/13205) (score: 0.5027) ##  1° Year of course - Second seme...
4): (tokens: 166) (url: https://degree.units.it/it/0320106204800001/area-studenti/insegnamenti/2025/115472-3/2017/9999/10333/2025/13205) (score: 0.5009) ##  1° Anno - Secondo Semestre 

Fr...",pass,0.5056,https://degree.units.it/it/0320106204800001/area-studenti/insegnamenti/2025/121259-4/2025/9999/10792/2025/13237,1.0,1.0
Che lezioni ci sono di martedì per il corso di statistica 1 anno nel secondo semestre?,Nel materiale a disposizione non sono presenti informazioni a riguardo,Le informazioni fornite non specificano le lezioni che si tengono di martedì per il corso di statistica del primo anno nel secondo semestre.,absent for choice,"1): (tokens: 115) (url: https://degree.units.it/en/0320107304100001/students-area/taught-courses/2025/117941/2025/1/10801/2025/13028) (score: 0.4989) ##  1° Year of course - Second seme...
2): (tokens: 119) (url: https://degree.units.it/en/0320107304100001/students-area/taught-courses/2025/117941/2025/2/10801/2025/13029) (score: 0.4986) ##  1° Year of course - Second seme...
3): (tokens: 17) (url: https://degree.units.it/en/0320107304100001/students-area/taught-courses/2026/114215/2025/1/10801/2025/13028) (score: 0.4950) ##### Teaching modality

The lectur...
4): (tokens: 17) (url: https://degree.units.it/en/0320107304100001/students-area/taught-courses/2026/119811/2025/1/10801/2025/13028) (score: 0.4868) ##### Teaching modality

The lectur...",pass,0.4989,https://degree.units.it/en/0320107304100001/students-area/taught-courses/2025/117941/2025/1/10801/2025/13028,1.0,0.9167
Qual'era il menu della mensa centrale il 27 aprile 2026?,Nel materiale a disposizione non sono presenti informazioni a riguardo,Le informazioni sul menu della mensa centrale per il 27 aprile 2026 non sono disponibili.,absent for choice,"1): (tokens: 59) (url: https://lauree.units.it/it/0320106204800010/piano-di-studi) (score: 0.3581) # Piano di studi

> Il file del Pia...
2): (tokens: 21) (url: https://degree.units.it/en/0320106204800001/students-area/taught-courses/2025/117801/2017/9999/10333/2023/) (score: 0.3543) # FOOD EDUCATION ELEMENTS

[547ME] ...
3): (tokens: 21) (url: https://degree.units.it/en/0320106204800001/students-area/taught-courses/2025/117801/2017/9999/10333/2025/13205) (score: 0.3543) # FOOD EDUCATION ELEMENTS

[547ME] ...
4): (tokens: 42) (url: https://degree.units.it/en/0320106204700001/study-plan) (score: 0.3478) # Study plan

> The 2026/27 Study P...",pass,0.3581,https://lauree.units.it/it/0320106204800010/piano-di-studi,0.0,0.5833
Quali sono gli strumenti richiesti per la prova di laboratorio di botania sistematica (corso scienze e tecnologie per l'ambiente e la natura)?,Nel materiale a disposizione non sono presenti informazioni a riguardo,Le informazioni fornite non contengono dettagli sugli strumenti richiesti per la prova di laboratorio di botanica sistematica. I documenti disponibili riguardano il laboratorio di Zoologia e il corso di Chimica Generale con laboratorio.,absent for choice,"1): (tokens: 548) (url: https://lauree.units.it/it/0320106203200001/area-studenti/insegnamenti/2025/119327/2023/3/10166/2023/13282) (score: 0.4681) ## 

Il laboratorio di Zoologia int...
2): (tokens: 485) (url: https://lauree.units.it/it/0320106203200001/area-studenti/insegnamenti/2025/112584/2025/3/10794/2025/13316) (score: 0.4629) ## 

• L'insegnamento si avvale del...
3): (tokens: 709) (url: https://lauree.units.it/it/0320106203200001/area-studenti/insegnamenti/2025/112584/2025/3/10794/2025/13316) (score: 0.4592) ## 

• Le modalità di verifica dell...
4): (tokens: 94) (url: https://lauree.units.it/it/0320106203200001/area-studenti/insegnamenti/2025/112584/2025/3/10794/2025/13316) (score: 0.4549) ## 

• Matematica e Fisica di base....",pass,0.4681,https://lauree.units.it/it/0320106203200001/area-studenti/insegnamenti/2025/119327/2023/3/10166/2023/13282,0.6667,0.4167
Sono previsti esami TOLC al quinto piano di H3 per settembre 2027?,Nel materiale a disposizione non sono presenti informazioni a riguardo,"Le informazioni disponibili non specificano date o luoghi per gli esami TOLC, né fanno riferimento a settembre 2027 o al quinto piano di H3.",absent for choice,"1): (tokens: 46) (url: https://lauree.units.it/it/0320107301400001/semestre-aperto) (score: 0.4126) ##### Ammissione

**Numero programm...
2): (tokens: 46) (url: https://lauree.units.it/it/0320107301400001/semestre-aperto/immatricolazione) (score: 0.4086) ##### Ammissione

**Numero programm...
3): (tokens: 46) (url: https://lauree.units.it/it/0320107301400002/semestre-aperto) (score: 0.4079) ##### Ammissione

**Numero programm...
4): (tokens: 46) (url: https://lauree.units.it/it/0320107301400002/semestre-aperto/immatricolazione) (score: 0.4041) ##### Ammissione

**Numero programm...",pass,0.4126,https://lauree.units.it/it/0320107301400001/semestre-aperto,1.0,1.0
Come si chiama l'edificio del corso di gastornomia?,Nel materiale a disposizione non sono presenti informazioni a riguardo,Le informazioni relative all'edificio del corso di gastronomia non sono disponibili.,absent for choice,"1): (tokens: 26) (url: https://lauree.units.it/it/0320107311900002/il-corso) (score: 0.3910) ##### Sede

La sede di svolgimento ...
2): (tokens: 17) (url: https://degree.units.it/en/0320106204800001/students-area/taught-courses/2025/116182-3/2017/9999/10333/2025/13205) (score: 0.3883) ##### Teaching modality

The lectur...
3): (tokens: 26) (url: https://lauree.units.it/it/0320107311900002) (score: 0.3800) ##### Sede

La sede di svolgimento ...
4): (tokens: 17) (url: https://degree.units.it/en/0320107304700001/students-area) (score: 0.3773) ##### Teaching modality

The lectur...",pass,0.391,https://lauree.units.it/it/0320107311900002/il-corso,1.0,0.5
Dove si trova l'ufficio del prof Mario Rossi di Fisica?,Nel materiale a disposizione non sono presenti informazioni a riguardo,Le informazioni relative all'ufficio del prof Mario Rossi di Fisica non sono disponibili nel contesto fornito.,absent for choice,"1): (tokens: 36) (url: https://degree.units.it/en/0320107308000002/students-area/taught-courses/2025/119283/2025/9999/10804) (score: 0.3233) ##### PA 110 cum laude

For this pr...
2): (tokens: 36) (url: https://degree.units.it/it/0320106204700001/area-studenti/insegnamenti/2025/116213/2024/9999/10329/2025/) (score: 0.3137) ##### PA 110 cum laude

For this pr...
3): (tokens: 39) (url: https://degree.units.it/it/0320106204700001/area-studenti/insegnamenti/2025/119954/2024/9999/10329/2024/) (score: 0.3129) ##### Ammissione

**Numero programm...
4): (tokens: 36) (url: https://lauree.units.it/it/0320107301800010) (score: 0.3106) ##### PA 110 cum laude

For this pr...",pass,0.3233,https://degree.units.it/en/0320107308000002/students-area/taught-courses/2025/119283/2025/9999/10804,1.0,1.0
Perché gli studenti russi devono frequentare un corso di italiano obbligatorio prima di iniziare le lezioni,Nel materiale a disposizione non sono presenti informazioni a riguardo,"Le informazioni disponibili non specificano il motivo per cui gli studenti russi debbano frequentare un corso di italiano obbligatorio prima di iniziare le lezioni. Viene indicato che per seguire correttamente i contenuti di un corso, lo studente deve possedere le basi della lingua italiana.",absent for choice,"1): (tokens: 34) (url: https://degree.units.it/en/0320106204800001/students-area/taught-courses/2025/117801/2017/9999/10333/2023/) (score: 0.4231) ## 

To properly follow the course ...
2): (tokens: 49) (url: https://lauree.units.it/it/0320107051400003/area-studenti/frequentare) (score: 0.4095) ##### Ammissione

**Accesso libero ...
3): (tokens: 49) (url: https://lauree.units.it/it/0320107051400003/area-studenti/insegnamenti/2025/118486/2025/9999/10775/2025/13245) (score: 0.4024) ##### Ammissione

**Accesso libero ...
4): (tokens: 110) (url: https://lauree.units.it/it/0320107312000001/area-studenti/insegnamenti/2025/119545/2022/9999/10654/2025/) (score: 0.4021) ## 

Frequenza Non obbligatoria

  ...",pass,0.4231,https://degree.units.it/en/0320106204800001/students-area/taught-courses/2025/117801/2017/9999/10333/2023/,1.0,0.6389
Dove si trova il bar più vicino alla sede centrale dell'università?,Nel materiale a disposizione non sono presenti informazioni a riguardo,Le informazioni fornite non contengono dettagli sulla posizione del bar più vicino alla sede centrale dell'università.,absent for choice,"1): (tokens: 27) (url: https://lauree.units.it/it/0320106204800010/area-studenti/laurea/laurea-info-specifiche) (score: 0.3955) ##### Sede

La sede di svolgimento ...
2): (tokens: 27) (url: https://lauree.units.it/it/0320106204800010/area-studenti) (score: 0.3944) ##### Sede

La sede di svolgimento ...
3): (tokens: 27) (url: https://lauree.units.it/it/0320106204800010/area-studenti/laurea/laurea-info-generali) (score: 0.3913) ##### Sede

La sede di svolgimento ...
4): (tokens: 27) (url: https://lauree.units.it/it/0320106204800010/area-studenti/app) (score: 0.3851) ##### Sede

La sede di svolgimento ...",pass,0.3955,https://lauree.units.it/it/0320106204800010/area-studenti/laurea/laurea-info-specifiche,1.0,1.0
Esiste un posto bici custodito in sede centrale?,Nel materiale a disposizione non sono presenti informazioni a riguardo,Non è possibile determinare se esista un posto bici custodito in sede centrale basandosi sulle informazioni fornite.,absent for choice,"1): (tokens: 53) (url: https://df.units.it/it/dipartimento/strutture-del-dipartimento/biblioteche) (score: 0.3642) ##  Biblioteca Europa.Generale

Ind...
2): (tokens: 23) (url: https://degree.units.it/it/0320106204700003/area-studenti/insegnamenti/2025/118256/2022/9999/10505/2025) (score: 0.3602) ##### Sede

La sede di svolgimento ...
3): (tokens: 23) (url: https://degree.units.it/it/0320106204700003/area-studenti/insegnamenti/2025/118256/2022/9999/10505/2023/13230) (score: 0.3602) ##### Sede

La sede di svolgimento ...
4): (tokens: 23) (url: https://degree.units.it/it/0320106204700003/area-studenti/insegnamenti/2025/121239/2022/9999/10505/2023) (score: 0.3592) ##### Sede

La sede di svolgimento ...",pass,0.3642,https://df.units.it/it/dipartimento/strutture-del-dipartimento/biblioteche,1.0,1.0
Cosa prevede il regolamento universitario in merito all'abbigliamento estivo,Nel materiale a disposizione non sono presenti informazioni a riguardo,Il contesto fornito non contiene informazioni specifiche riguardo al regolamento universitario in merito all'abbigliamento estivo.,absent for choice,"1): (tokens: 322) (url: https://amm.units.it/normativa/regolamenti/articolo-22088/art-35-norme-disciplinari) (score: 0.4359) # Art. 35 - Norme disciplinari

1\....
2): (tokens: 359) (url: https://degree.units.it/en/0320107304100001/students-area/regulations-and-documents) (score: 0.4315) # Regulations and documents

**Univ...
3): (tokens: 338) (url: https://amm.units.it/normativa/regolamenti/articolo-30666/articolo-1-ambito-applicazione-e-normativa-riferimento) (score: 0.4307) # Articolo 1 – Ambito di applicazio...
4): (tokens: 359) (url: https://degree.units.it/en/0320107308000002/students-area/regulations-and-documents) (score: 0.4277) # Regulations and documents

**Univ...",pass,0.4359,https://amm.units.it/normativa/regolamenti/articolo-22088/art-35-norme-disciplinari,1.0,0.9167
Perché al corso di traduzione e interpretazioni c'è una presenta maggioritaria di studentesse femmine?,Nel materiale a disposizione non sono presenti informazioni a riguardo,"Le informazioni fornite non contengono dettagli sulla composizione di genere degli studenti iscritti al corso di traduzione e interpretazione, né sulle ragioni di una eventuale maggioranza di studentesse femmine.",absent for choice,"1): (tokens: 22) (url: https://lauree.units.it/it/0320107309500008/area-studenti) (score: 0.4461) ##### Modalità di erogazione

Le le...
2): (tokens: 388) (url: https://lauree.units.it/it/0320107309500008/il-corso) (score: 0.4385) # Il corso

  * ### Perché iscriver...
3): (tokens: 382) (url: https://lauree.units.it/it/0320107309500008/il-corso) (score: 0.4335) ### Conoscenza e comprensione.

Tra...
4): (tokens: 727) (url: https://lauree.units.it/it/0320107309500008/il-corso) (score: 0.4282) ### Capacità di applicare conoscenz...",pass,0.4461,https://lauree.units.it/it/0320107309500008/area-studenti,1.0,0.5833
Esiste un esame di canto lirico al corso di musicologia?,Nel materiale a disposizione non sono presenti informazioni a riguardo,Non è presente alcuna informazione riguardo a un esame di canto lirico al corso di musicologia.,absent for choice,"1): (tokens: 39) (url: https://degree.units.it/it/0320106204700003/area-studenti/insegnamenti/2025/121241/2022/9999/10505/2025) (score: 0.4341) ##### Ammissione

**Numero programm...
2): (tokens: 39) (url: https://degree.units.it/it/0320106204700003/area-studenti/insegnamenti/2025/120807-1/2022/9999/10505/2025) (score: 0.4331) ##### Ammissione

**Numero programm...
3): (tokens: 538) (url: https://lauree.units.it/it/0320106204800001-1/area-studenti/insegnamenti/2025/121258-3/2025/9999/10792/2025/13237) (score: 0.4313) ## 

L’esame del Corso di Istologia...
4): (tokens: 538) (url: https://degree.units.it/it/0320106204800001/area-studenti/insegnamenti/2025/121258-3/2025/9999/10792/2025/13237) (score: 0.4313) ## 

L’esame del Corso di Istologia...",pass,0.4341,https://degree.units.it/it/0320106204700003/area-studenti/insegnamenti/2025/121241/2022/9999/10505/2025,1.0,1.0
Perché l'università degli studi di Trieste è considerata la migliore università del mondo?,Nel materiale a disposizione non sono presenti informazioni a riguardo,"Le informazioni fornite non indicano che l'Università degli Studi di Trieste sia considerata la migliore università del mondo. Il contesto evidenzia che l'Ateneo è stato collocato nella fascia più alta dell'accreditamento periodico dall'ANVUR, ricevendo un giudizio ""pienamente soddisfacente"" e confermandosi tra gli atenei di eccellenza in Italia. Vengono inoltre menzionati punti di forza come l'internazionalizzazione, l'alto numero di studenti stranieri, l'offerta di doppi titoli e titoli congiunti con università europee, il coinvolgimento degli studenti nei processi decisionali, l'innovazione didattica e il sostegno alla ricerca.",absent for choice,"1): (tokens: 102) (url: https://degree.units.it/en/0320107300700003/students-area/internship) (score: 0.4273) #### The Trieste System

The ""Tries...
2): (tokens: 383) (url: https://amm.units.it/placement/testimonial/livio-tenze) (score: 0.4262) **7) COSA PORTI CON TE DELL’ESPERIE...
3): (tokens: 903) (url: https://amm.units.it/normativa/regolamenti/articolo-22145/art-1-natura-e-fini) (score: 0.4193) # Art. 1 - Natura e fini

1\. L'Uni...
4): (tokens: 816) (url: https://portale.units.it/it/visita-accreditamento-anvur-2025) (score: 0.4160) ## Approvato il Rapporto di accredi...",pass,0.4273,https://degree.units.it/en/0320107300700003/students-area/internship,1.0,1.0
